QuestionID,Question,Answer,Document
Q341,how many lungs does a human have,question_answering,Human lung
Q342,how long to take iwo jima,question_answering,Battle of Iwo Jima
Q343,What a Margarita contains,question_answering,Margarita
Q344,what color is burgundy,question_answering,Burgundy (color)
Q345,what color is burgundy,question_answering,Burgundy (color)
Q346,what is the population of center tx,question_answering,"Center, Texas"
Q347,what causes photo red eye,question_answering,Red-eye effect
Q348,what creates a cloud,question_answering,Cloud
Q349,how many students go to santa barbara,question_answering,"University of California, Santa Barbara"
Q350,what day is the feast of st joseph's?,question_answering,Saint Joseph's Day
Q351,what culture is mariah carey,question_answering,Mariah Carey
Q352,how was color introduced in film?,question_answering,Color motion picture film
Q353,how was color introduced in film?,question_answering,Color motion picture film
Q354,what artist have song with ashanti?,question_answering,Ashanti (entertainer)
Q355,what came first army or air force,question_answering,United States Army Air Forces
Q356,what day is 2011 super bowl?,question_answering,Super Bowl XLV
Q357,what does the FOIA apply to,question_answering,Freedom of Information Act (United States)
Q358,how many countries are member of the eu?,question_answering,European Union
Q359,how many vehicles are registered in the us,question_answering,Passenger vehicles in the United States
Q360,what does a laboratory in a gynecologist office consist of,question_answering,Medical laboratory
Q361,what cards do you need in poker to get a royal flush,question_answering,List of poker hands
Q362,what does xylem transport,question_answering,Xylem
Q363,how many mvps has kobe bryant won,question_answering,Kobe Bryant
Q364,what do jehovah witnesses believe,question_answering,Jehovah's Witnesses
Q365,what do jehovah witnesses believe,question_answering,Jehovah's Witnesses
Q366,how old old is xp operating system,question_answering,Windows XP
Q367,how many pawns in chess,question_answering,Pawn (chess)
Q368,what countries allow gays to openly serve in the military,question_answering,Sexual orientation and military service
Q369,How Works Diaphragm Pump,question_answering,Diaphragm pump
Q370,how is hydrogen produced,question_answering,Hydrogen production
Q371,how many percent is a basis point,question_answering,Basis point
Q372,how many percent is a basis point,question_answering,Basis point
Q373,how many percent is a basis point,question_answering,Basis point
Q374,what genre is bloody beetroots,question_answering,The Bloody Beetroots
Q375,what country is madrid spain in,question_answering,Madrid
Q376,What causes rogue waves,question_answering,Rogue wave
Q377,what happened to montgomery clift,question_answering,Montgomery Clift
Q378,how many asian indians live in usa,question_answering,Indian American
Q379,what caused the world war 2,question_answering,Causes of World War II
Q380,what caused the world war 2,question_answering,Causes of World War II
Q381,what happened to george o'malley on grey's anatomy?,question_answering,George O'Malley
Q382,what happened to george o'malley on grey's anatomy?,question_answering,George O'Malley
Q383,what happened to george o'malley on grey's anatomy?,question_answering,George O'Malley
Q384,what happened to george o'malley on grey's anatomy?,question_answering,George O'Malley
Q385,how many people die from myasthenia gravis per year,question_answering,Myasthenia Gravis
Q386,how many rooms in borgata hotel,question_answering,The Borgata
Q387,what country has the most muslims in the world,question_answering,Islam by country
Q388,what country is dubai in,question_answering,Dubai
Q389,how much of earth is covered ocean water,question_answering,Ocean
Q390,how is root beer made?,question_answering,Root beer
Q391,how much did yankee stadium cost,question_answering,Yankee Stadium
Q392,what does informal logic mean,question_answering,Informal logic
Q393,what country is turkey in,question_answering,Turkey
Q394,what country is turkey in,question_answering,Turkey
Q395,"what county is Augusta,GA located in?",question_answering,"Augusta, Georgia"
Q396,"What happened to ""The Glades"" tv series",question_answering,The Glades (TV series)
Q397,how many albums has eminem sold in his career,question_answering,Eminem
Q398,what do pigs eat,question_answering,Pig
Q399,what does a cutter do,question_answering,Cutter (baseball)
Q400,what it takes aerosmith album,question_answering,What It Takes (song)
Q401,what it takes aerosmith album,question_answering,What It Takes (song)
Q402,what county is erie colorado,question_answering,"Erie, Colorado"
Q403,What happened during the Starving Time in Jamestown?,question_answering,Starving Time
Q404,What happened during the Starving Time in Jamestown?,question_answering,Starving Time
Q405,What happened during the Starving Time in Jamestown?,question_answering,Starving Time
Q406,what classes are considered humanities,question_answering,Humanities
Q407,what classes are considered humanities,question_answering,Humanities
Q408,what classes are considered humanities,question_answering,Humanities
Q409,what classes are considered humanities,question_answering,Humanities
Q410,what does the president of the usa do,question_answering,President of the United States
Q411,what does the president of the usa do,question_answering,President of the United States
Q412,what does the president of the usa do,question_answering,President of the United States
Q413,what food is in afghan,question_answering,Afghan cuisine
Q414,what food is in afghan,question_answering,Afghan cuisine
Q415,how kimberlite pipes form,question_answering,Volcanic pipe
Q416,how many seasons of grey's anatomy are there,question_answering,Grey's Anatomy
Q417,how is schizophrenia diagnosed?,question_answering,Schizophrenia
Q418,what kind of cut is tri tip,question_answering,Tri-tip
Q419,what kind of cut is tri tip,question_answering,Tri-tip
Q420,what county is willmar mn in?,question_answering,"Willmar, Minnesota"
Q421,what kind of company is Microsoft?,question_answering,Microsoft
Q422,how does weather happen,question_answering,Weather
Q423,how many countries have english as an official language,question_answering,List of countries where English is an official language
Q424,what countries are in cono sur,question_answering,Southern Cone
Q425,what countries are in cono sur,question_answering,Southern Cone
Q426,how many innings makes an official game,question_answering,Official game
Q427,what branch of the military is delta force,question_answering,Delta Force
Q428,what causes the seasons,question_answering,Season
Q429,what does 3g network mean,question_answering,3G
Q430,what does Mazel tov! mean,question_answering,Mazel tov
Q431,How Do You Get Hepatitis C,question_answering,Hepatitis C
Q432,how does flexible spending account work,question_answering,Flexible spending account
Q433,how tennessee became a state,question_answering,Tennessee
Q434,how many baseball teams usa,question_answering,Major league baseball
Q435,what county is coatesville indiana located in,question_answering,"Coatesville, Indiana"
Q436,how does Delaware support its claim to being the first state?,question_answering,Delaware
Q437,how many amendments in the US constitution,question_answering,List of amendments to the United States Constitution
Q438,what does fidelity do,question_answering,Fidelity Investments
Q439,what causes thunder sound,question_answering,Thunder
Q440,what causes thunder sound,question_answering,Thunder
Q441,what day is the federal holiday for Martin Luther King Jr.,question_answering,"Martin Luther King, Jr. Day"
Q442,what area code is 949,question_answering,Area code 949
Q443,what does continuous improvement mean,question_answering,Continual improvement process
Q444,what area code is 810,question_answering,Area code 810
Q445,how many babies are in a typical raccoon litter,question_answering,Raccoon
Q446,what kind of earthquake was haiti,question_answering,2010 Haiti earthquake
Q447,what kind of horse was mr ed,question_answering,Mister Ed
Q448,What does Rapture meaning in a theological sense?,question_answering,Rapture
Q449,who does chris humphries play for,question_answering,Kris Humphries
Q450,what are corporation balance,question_answering,Balance sheet
Q451,what is .17 hmr caliber,question_answering,.17 HMR
Q452,what made the civil war different from others,question_answering,American Civil War
Q453,where to buy potato bread made without wheat,question_answering,Potato bread
Q454,what year was the 8 track invented,question_answering,8-track tape
Q455,what are points on a mortgage,question_answering,Point (mortgage)
Q456,who killed julius caesar,question_answering,Julius caesar
Q457,what are  the  official languages of nigeria,question_answering,Languages of Nigeria
Q458,"who played guitar on the kiss album, creatures of the night",question_answering,Creatures of the Night
Q459,who wrote white christmas,question_answering,White Christmas (song)
Q460,what are the different types of cross country skiing,question_answering,Cross-country skiing
Q461,what are use taxes?,question_answering,Use tax
Q462,what are use taxes?,question_answering,Use tax
Q463,what are use taxes?,question_answering,Use tax
Q464,WHAT IS A FY QUARTER,question_answering,Fiscal year
Q465,who pulmonary hypertension,question_answering,Pulmonary hypertension
Q466,what is an array in programming,question_answering,Array programming
Q467,what is an array in programming,question_answering,Array programming
Q468,who wrote a rose is a rose is a rose,question_answering,Rose is a rose is a rose is a rose
Q469,what is a notary for,question_answering,Notary public
Q470,what is a notary for,question_answering,Notary public
Q471,when did the cold war start,question_answering,Cold War
Q472,what state is pike's peak in?,question_answering,Pikes Peak State Park
Q473,what state is jakarta in?,question_answering,Jakarta
Q474,what song is sung in 6 foot 7 foot,question_answering,6 Foot 7 Foot
Q475,what is a book index,question_answering,Index (publishing)
Q476,who sings the song never ending story,question_answering,The NeverEnding Story (song)
Q477,who can file suspicious activity report,question_answering,Suspicious activity report
Q478,who created facebook,question_answering,Facebook
Q479,what are the sulfas,question_answering,Sulfonamide (medicine)
Q480,what are risk for infections,question_answering,Risk of infection
Q481,who owns joe's crab shack,question_answering,Joe's Crab Shack
Q482,where do cruises dock in new york city,question_answering,New York Passenger Ship Terminal
Q483,what is a right wing christian,question_answering,Christian right
Q484,who played the lead roles in the movie leaving las vegas,question_answering,Leaving Las Vegas
Q485,what is a CMM machine,question_answering,Coordinate-measuring machine
Q486,what percentage of water in in the body,question_answering,Body water
Q487,what percentage of water in in the body,question_answering,Body water
Q488,what type of batteries are 357 (LR44),question_answering,LR44 battery
Q489,where did hurricane katrina begin,question_answering,Hurricane Katrina
Q490,where did hurricane katrina begin,question_answering,Hurricane Katrina
Q491,what is an assist in basketball,question_answering,Assist (basketball)
Q492,what is 1 mil guaranies in united states dollars,question_answering,Mill (currency)
Q493,where did the persian war take place,question_answering,Greco-Persian Wars
Q494,where did the persian war take place,question_answering,Greco-Persian Wars
Q495,where did the persian war take place,question_answering,Greco-Persian Wars
Q496,where did the persian war take place,question_answering,Greco-Persian Wars
Q497,where did the persian war take place,question_answering,Greco-Persian Wars
Q498,where did the persian war take place,question_answering,Greco-Persian Wars
Q499,where did the persian war take place,question_answering,Greco-Persian Wars
Q500,what is a day care for?,question_answering,Day care
Q501,who discovered neptune the planet,question_answering,Discovery of Neptune
Q502,what separates me from you album,question_answering,What Separates Me from You
Q503,when did thomson make the plum-pudding model,question_answering,Plum pudding model
Q504,what part of the pig is bacon,question_answering,Bacon
Q505,where did erisa come from,question_answering,Employee Retirement Income Security Act
Q506,where did erisa come from,question_answering,Employee Retirement Income Security Act
Q507,what percent of illegal immigrants are from mexico and europe,question_answering,Illegal immigration to the United States
Q508,what school district is alvin in?,question_answering,Alvin Independent School District
Q509,what are the houses of hogwarts,question_answering,Hogwarts
Q510,when us subprime mortgage market collapse,question_answering,Subprime mortgage crisis
Q511,What kind of personality test is the MBTI,question_answering,Myers-Briggs Type Indicator
Q512,What kind of personality test is the MBTI,question_answering,Myers-Briggs Type Indicator
Q513,What kind of personality test is the MBTI,question_answering,Myers-Briggs Type Indicator
Q514,what type of game is heavy rain,question_answering,Heavy Rain
Q515,what are superannuation contributions?,question_answering,Superannuation in Australia
Q516,where does a flea live,question_answering,Flea
Q517,what is a group of deer called,question_answering,Deer
Q518,what state was john mccain a senator in during the 2008 election,question_answering,"United States presidential election, 2008"
Q519,when does the electoral college votes,question_answering,Electoral College (United States)
Q520,when barack obama was born,question_answering,Barack Obama
Q521,who wrote rhythm of the ancient mariner,question_answering,The Rime of the Ancient Mariner
Q522,when did freddie mercury die,question_answering,Freddie Mercury
Q523,what is a .PAC file,question_answering,Proxy auto-config
Q524,what is a .PAC file,question_answering,Proxy auto-config
Q525,what are spoilers for,question_answering,Spoiler (automotive)
Q526,who sings i am a man of constant sorrow,question_answering,Man of Constant Sorrow
Q527,who kill franz ferdinand ww1,question_answering,Assassination of Archduke Franz Ferdinand of Austria
Q528,what year did disney's animal kingdom lodge open,question_answering,Disney's Animal Kingdom Lodge
Q529,what are two languages in Nigeria?,question_answering,Languages of Nigeria
Q530,what war led to Pearl Harbor,question_answering,Events leading to the attack on Pearl Harbor
Q531,what is a mms message,question_answering,Multimedia Messaging Service
Q532,where in the world are smallpox common,question_answering,Smallpox
Q533,what year did the beatles came out with the song i wanna hold your hand,question_answering,I Want to Hold Your Hand
Q534,what year did the beatles came out with the song i wanna hold your hand,question_answering,I Want to Hold Your Hand
Q535,what is a gasser car,question_answering,Gasser (car)
Q536,what tensions preceded the berlin blockade,question_answering,Berlin Blockade
Q537,who sang proud mary,question_answering,Proud Mary
Q538,who sang that song-a change is going to come,question_answering,A Change Is Gonna Come
Q539,where do crocodiles live,question_answering,Crocodile
Q540,what percentage of the human body is water,question_answering,Body water
Q541,what relates to erosion,question_answering,Erosion
Q542,what relates to erosion,question_answering,Erosion
Q543,what is a form of legal ownership,question_answering,Ownership
Q544,where in oregon is albany,question_answering,"Albany, Oregon"
Q545,where in oregon is albany,question_answering,"Albany, Oregon"
Q546,who wrote what's my name rihanna,question_answering,What's My Name? (Rihanna song)
Q547,what year did isaac newton die,question_answering,Isaac Newton
Q548,what is a constant in math?,question_answering,Mathematical constant
Q549,when did abraham lincoln write the emancipation proclamation??,question_answering,Emancipation Proclamation
Q550,what part of the pre-world war 1 arms race was the most intense?,question_answering,Causes of World War I
Q551,who owns land rover,question_answering,Land Rover
Q552,what states have legalized prostitution,question_answering,Prostitution in the United States
Q553,what states are on the east coast,question_answering,East Coast of the United States
Q554,when president nixon resigns,question_answering,Richard Nixon
Q555,when did sertraline come on the market,question_answering,Sertraline
Q556,where fourth of july came from,question_answering,Independence Day (United States)
Q557,when did secretariat win,question_answering,Secretariat (horse)
Q558,what are batteries made up of,question_answering,Automotive battery
Q559,what are batteries made up of,question_answering,Automotive battery
Q560,what is a full job time??,question_answering,Full-time
Q561,what are the three primary colors in the subtractive color model,question_answering,Subtractive color
Q562,what are layers of the ionosphere,question_answering,Ionosphere
Q563,what people used mayan numeral system,question_answering,Maya numerals
Q564,what is a newsgroup message,question_answering,Usenet newsgroup
Q565,who plays as big bird,question_answering,Big Bird
Q566,who plays as big bird,question_answering,Big Bird
Q567,who accompanied King louis the VII of France on the second crusade,question_answering,Second Crusade
Q568,who founded walmart,question_answering,Walmart
Q569,what are some legal uses of meth,question_answering,Methamphetamine
Q570,when did gary moore die,question_answering,Gary Moore
Q571,what is 6 pin din connector,question_answering,Mini-DIN connector
Q572,what is a hosting company on a website,question_answering,Web hosting service
Q573,Where does the word baptism come from,question_answering,Baptism
Q574,what school did Zach Thomas play for before making it in to the NFL,question_answering,Zach Thomas
Q575,what order is the moth,question_answering,Moth
Q576,what are the uses for gui,question_answering,Graphical user interface
Q577,who won antm cycle 12,question_answering,"America's Next Top Model, Cycle 12"
Q578,who owns exxon mobil,question_answering,ExxonMobil
Q579,who built the globe,question_answering,Globe Theatre
Q580,what are warehouse spreadsheets used for,question_answering,Data warehouse
Q581,what are warehouse spreadsheets used for,question_answering,Data warehouse
Q582,what are warehouse spreadsheets used for,question_answering,Data warehouse
Q583,what is a rock quarry,question_answering,Quarry
Q584,what kind of school is MIT,question_answering,MIT Sloan School of Management
Q585,Who Started the Mormon Church,question_answering,Mormons
Q586,what are banana plugs for,question_answering,Banana connector
Q587,what part of the earth's structure is believed to consist of tectonic plates,question_answering,Plate tectonics
Q588,when did the trojan war take place,question_answering,Trojan War
Q589,what is a letterbox movie,question_answering,Letterboxing (filming)
Q590,what is a letterbox movie,question_answering,Letterboxing (filming)
Q591,who won the 2009 super bowl,question_answering,Super Bowl XLIII
Q592,what is a popular people meter,question_answering,People meter
Q593,what are the characteristics of bryophytes,question_answering,Bryophyte
Q594,when to use semicolon,question_answering,Semicolon
Q595,when did xbox release,question_answering,Xbox
Q596,what is a roll play games,question_answering,Role-playing game
Q597,when did the civil war start and where,question_answering,American Civil War
Q598,What are the busiest airports in the world,question_answering,World's busiest airport
Q599,where the streets have no name filming location,question_answering,Where the Streets Have No Name
Q600,where did the mayflower land,question_answering,Mayflower
Q601,what is a forward in soccer,question_answering,Forward (association football)
Q602,WHO QUALIFIES AS A DOMESTIC PARTNER IN CA,question_answering,Domestic partnership in California
Q603,where did mark jackson play pro basketball?,question_answering,Mark Jackson (basketball)
Q604,what languages are spoken in south africa,question_answering,Languages of South Africa
Q605,what languages are spoken in south africa,question_answering,Languages of South Africa
Q606,Who controlled Alaska before US?,question_answering,Alaska
Q607,what are stink bombs made of,question_answering,Stink bomb
Q608,what are stink bombs made of,question_answering,Stink bomb
Q609,who sang black velvet,question_answering,Black Velvet (song)
Q610,"who said ""A picture is worth a thousand words""?",question_answering,A picture is worth a thousand words
Q611,who produced loyal to the game?,question_answering,Loyal to the Game
Q612,WHAT ARE HERITABLE TRAITS,question_answering,Heritability
Q613,who does afge represent,question_answering,American Federation of Government Employees
Q614,what teams won super bowl,question_answering,List of Super Bowl champions
Q615,what year was christianity introduced to sub-saharan africa,question_answering,Christianity in Africa
Q616,who wrote puff the magic dragon,question_answering,"Puff, the Magic Dragon"
Q617,when did expos become nationals,question_answering,Washington Nationals
Q618,what is a contingent fee with an attorney,question_answering,Contingent fee
Q619,what is a D.O. stand for medical doctor,question_answering,Doctor of Osteopathic Medicine
Q620,what is a vetting process,question_answering,Vetting
Q621,when did the free soilers party start?,question_answering,Free Soil Party
Q622,who reports the consumer price index,question_answering,Consumer Price Index
Q623,"where does the expression ""knocking on wood"" come from",question_answering,Knocking on wood
Q624,what are rocker arms?,question_answering,Rocker arm
Q625,who sang the nights the lights went out,question_answering,The Night the Lights Went Out in Georgia
Q626,who sang the nights the lights went out,question_answering,The Night the Lights Went Out in Georgia
Q627,where does the return address go on mail,question_answering,Return address
Q628,where does the return address go on mail,question_answering,Return address
Q629,when did steven adler play for guns and roses,question_answering,Steven Adler
Q630,what is a synthetic conduit,question_answering,Nerve guidance conduit
Q631,what is a wwII theater,question_answering,European Theatre of World War II
Q632,what is amoxicillin for?,question_answering,Amoxicillin
Q633,what state was the civil war in,question_answering,American Civil War
Q634,where did the early humans live?,question_answering,Human evolution
Q635,where did the early humans live?,question_answering,Human evolution
Q636,who invaded north africa during ww2,question_answering,Operation Torch
Q637,WHAT YEARS WAS THE C5 VETTE PRODUCED,question_answering,Chevrolet Corvette (C5)
Q638,what year was gulf war,question_answering,Gulf War
Q639,What U.S. President's head has been featured on the nickel (five-cent coin) since 1938?,question_answering,Nickel (United States coin)
Q640,who sings stand by me,question_answering,Stand by Me (song)
Q641,When did F15s first fly,question_answering,McDonnell Douglas F-15 Eagle
Q642,what year was elvis born,question_answering,Elvis Presley
Q643,what are the arb medications,question_answering,ARB
Q644,where did columbus really land in 1492?,question_answering,Christopher Columbus
Q645,what is a brindle boxer,question_answering,Boxer (dog)
Q646,what are SATA Power Connector,question_answering,Serial ATA
Q647,what are SATA Power Connector,question_answering,Serial ATA
Q648,who invented the internet,question_answering,History of the Internet
Q649,"What kind of poem is ""This is Just to Say""",question_answering,This Is Just To Say
Q650,when does the royal standard fly?,question_answering,Royal Standard of the United Kingdom
Q651,when does the royal standard fly?,question_answering,Royal Standard of the United Kingdom
Q652,who played dumbledore in harry potter,question_answering,Albus Dumbledore
Q653,who played dumbledore in harry potter,question_answering,Albus Dumbledore
Q654,what produces calcitonin,question_answering,Calcitonin
Q655,who hit the first home run at riverfront stadium?,question_answering,Riverfront Stadium
Q656,Who Makes Nexen Tires,question_answering,Nexen Tire
Q657,who did richard nixon refer to as the  silent majority,question_answering,Silent majority
Q658,who did richard nixon refer to as the  silent majority,question_answering,Silent majority
Q659,what the atmosphere on mercury,question_answering,Atmosphere of Mercury
Q660,What are the lateral and median apertures of the brain?,question_answering,Lateral aperture
Q661,what year did the last monkeys go into space,question_answering,Monkeys in space
Q662,what part of the pig do pork chops come from,question_answering,Pork chop
Q663,what are grits made from,question_answering,Grits
Q664,what religion is westminster abbey,question_answering,Westminster Abbey
Q665,when did coca cola first come out,question_answering,Coca-Cola
Q666,what role do ombudsman play in the swedish government?,question_answering,Ombudsman
Q667,what state is new england in,question_answering,New England
Q668,who played batman in dark knight,question_answering,The Dark Knight (film)
Q669,what are stanzas in poetry,question_answering,Stanza
Q670,what are stanzas in poetry,question_answering,Stanza
Q671,who shot franz ferdinand,question_answering,Assassination of Archduke Franz Ferdinand of Austria
Q672,who won the super in xl1,question_answering,Super Bowl XLI
Q673,what are the three ossicles,question_answering,Ossicles
Q674,what are the parts of plant stems?,question_answering,Plant stem
Q675,what is an army specialist,question_answering,Specialist (rank)
Q676,what year did martin luther king die,question_answering,"Martin Luther King, Jr."
Q677,what to make with linen,question_answering,Linen
